Valve: A Proposed solution to last minute roster-drop problem|self.DotA2|~Whether intentional or not, there is a huge problem facing the current system of adding and removing players from teams: the single day roster-lock. Because this lock is a single day, teams could simply align a new, available player in secret before dropping their teammate days or minutes before the lock. This leaves the dropped player severely disadvantaged in finding a team in a fair amount of time.

My proposition is as follows: instead of having a single day that teams can no longer add or remove players, **there are two dates instead: a "drop-lock" and an "add-lock"**. Once the drop-lock occurs, a team can no longer drop any of their players. But, any players dropped the day of this are not in vain: they still have some time left to find a new team. Any team with fewer than five players can still add players to their team before the add-lock date, perhaps two weeks after the drop-lock. This would easily and effectively solve the problem of unfairly excluding very talented players from acquiring a team quickly enough.

Any thoughts on this revised system?~|suggest esports
DotA 2 UI redesign|behance.net||suggest
Petition to push back the Birmingham Major|self.DotA2|Basically, everyone in the UK has exams round then so no one from the ages of 15 through to 21 is gonna show up (unless not at uni). I mean I know it won't happen but 1 up vote = 1 prayer! |suggest esports
6.87 is a great patch but the presentation feels rushed. Here's a list of #polish suggestions|self.DotA2|~**No new item sound effects**

* Tome of Knowledge is very underwhelming. It recycles the level up animation and is completely silent.

* Bloodthorn recycles the Orchid sound effect, when it should have its own unique sound. I've always adored Dota 2's sound design because you can tell what's happening with your eyes closed. This trend should continue.

* Hurricane Pike also recycles the Force Staff sound effect. Such a huge opportunity for some amazing sound effects with a name like HURRICANE PIKE.

* Blight Stone might not be required, but could be nice to have a very small sound effect like a mini Desolator impact sound.

&nbsp;

**Aghs upgrades are getting messy**

This might not be a huge issue once we get the upcoming UI update, but [as this post already covered](https://www.reddit.com/r/DotA2/comments/4htvqb/wouldnt_it_be_nice_to_have_cooldown_on_aghs_with/), there is no feedback to the player for some of the newer Aghs upgrades, such as what the Aghs upgrade does and failing to display the cooldowns.

&nbsp;

**Scan uses recycled assets and is a little confusing at first**

[As discussed on this post](https://www.reddit.com/r/DotA2/comments/4hadd4/til_scan_uses_the_same_minimap_indicator_as/d2onvg5), Scan should not use the TP minimap assets. In addition, it isn't immediately obvious to players what green or red mean when using scan.

&nbsp;

**Scan is unfriendly to spectators**

/u/somethingToDoWithMe:
> The scan ability is extremely spectator unfriendly. Both teams have the same color of scan so when a scan is used, you have to take notice of the team and how recently the scan was used to figure out which team used the scan.

>I also feel that having something that important be only on the minimap is bad for spectating. I think they need to show something over the actual ingame map so that observers can just move the camera over to the location and show the viewers what the area scanned was.


/u/aliboy:
> A voice line and event text should show up - similar to what exists currently for fortifying structures. Scan should have a default announcer line that says something along the lines of;

> "Dire have activated Scan"

> "Radiant have activated Scan"

> And when you are in game and your team uses it the announcer should say " Scan activated"


/u/VampoRainze:
> show scan in game not just minimap.

&nbsp;

**Dota lore**

/u/thjake:
> no lore for new items and abilities since 6.86


/u/-De-Koenisch-:
> Please rename Scan into something less technical.


I agree with this. Scan should be renamed to something that fits the lore of Dota a little better. I've heard various suggestions such as:

* Scry
* Eye of the Ancient (/u/SirActionSlacks-)
* Light of Heaven (/u/phipb)

&nbsp;

Feel free to post any additional suggestions and I'll add them here. I've always loved Dota 2's attention to detail and level of polish, and I hope Valve's dedication to presentation doesn't wane for future patches.~|suggest
Casters should introduce the observer|self.DotA2|~When the casters say hello for the first time they should mention the observer they are working with for that game.  "Hello everyone, my name is Capitalist, my analyst is Blitz, and our observer is Weppas, let's get into the draft."

Edit: as many people are saying, just a small text graphic would be enough too.  ~|suggest esports
Bounty runes should refill 2 charges, not refill to 2 charges.|self.DotA2|~Picking up a bounty rune with 1 charge in the bottle should get to 3 charges. It doesnt make sense the way it is right now.

It should replenish 2 charges, not replenish to 2 charges.~|suggest
If you gonna have timers on stun (and other debuffs), make it uniform like this|i.redd.it||suggest
PRO TIP: When you get low priority, equip your desert terrain and sirroco weather.|self.DotA2|Immerse yourself and roleplay as the banished adventurer, looking for escape from his exile.|suggest
New Treasure Idea|self.DotA2|~I just had this idea for an annual Champions Treasure, it could be immortals or sets.

It would contain items for the 5 heroes picked by the winning team on TI's final match. 

Example: TI6 treasure would contain KOTL, AM, Bat, Axe and ET items.

The sets could be created in cooperation with the winning team (like the Treasure of the Eternal Alliance).

Please Valve, make it happen!

EDIT: For the ones saying that LoL has been doing this for a while, I didn't really know. But I don't see it as a problem. Why can't we have something nice just because League has it?~|suggest
Let us Alt-Click our XP bar to tell our teammates our level & how much xp we need to the next one.|self.DotA2|~I find myself alt-clicking my XP bar quite often, as I want to tell a teammate that I'm soon level 6 or something similar. If you're close to reaching a crucial level it would be great to be able to tell this quickly, as it can change the outcome of a fight if your team plays accordingly.    
It's also useful for telling a teammate to stay out of XP range, so I can have solo XP and reach, for example, level 6.
~|suggest
Please Valve, let us at least keep the winter terrain.|self.DotA2|After this disaster of a Major, financed with our money - i think letting us keep the winter terrain would be a nice little apology.|suggest
Quests shouldn't have timers.|self.DotA2|~There have been many posts of people rushing an item that shouldn't be rushed and ruining games because of quests, that require you to get an item before a certain minute mark.

A quest should not be failed till the game is over. A lot of people will simply give up on the game if they don't get in item by the required minute mark.

In the future Valve should avoid puting timers on quests, but rather make us buy the item and then do something with it.
For instance "Build solar crest before game timer reaches X/Y/Z minutes." would now be "Purchase a Solar crest and kill 2/4/6 heroes that are affected by the Solar crest debuff."

So in general instead of rushing an item a quest would have you buy an item and then do something with it.

This type of quest allows us to get the item at any point in the game. Getting the item sooner will give you more time to complete the quest, but you also won't risk failing the quest if you don't rush it. It's also a lot more support friendly than the item rush quests.



**TL;DR:** Quests should not have timers that fail before the game ends, as that disincentivizes players from trying to win the game if they fail such a quest.
~|suggest
Please Remove The Hero of The Day from Ranked|self.DotA2|~I love the idea of rotating heros of the day, but I do not feel that it has a place in ranked.  It just gives an advantage to picking a few heroes and promotes spamming them in ranked.  The mango itself is kind of silly to me, but I feel that it gives a weird advantage right now and can be balanced a bit more if not removed entirely.  Instead of giving the mango to people that simply pick the hero of the day, give it to people that random.  

Edit: There seems to be confusion in the comments.  I have literally no problem with randoming, and I do not think that this is a sign of the end times.  However, I feel that ranked should be mostly free of advantages like this.  Randoming gave a risk vs reward deal because you could random into bad heroes for your line up, heroes that are easily counter able, or even bad heroes in the meta.  To balance this out, dota gave you some extra gold to make you feel better about doing it.  This never decided matches flat out and neither does the mango.  However, the risk vs reward deal is mostly gone with the Hero of the Day.  This is because you can pick a hero out of the 10 and get a reward.  For example, I have been picking TA and she becomes the hero of the day.  I now have an advantage when spamming her for that day.  With randoming that was impossible because you did not know what you were going to get.  I feel that this mechanic is cool as it promotes players to have larger hero pools, but I do not feel that it has a place necessarily in ranked.  I do not want my ranked games to be influenced (not decided) by a hero of the day mechanic that seems to be geared towards newer players.  Sorry for any confusion and sorry to the devs for complaining.  I genuinely love dota 2 and I love the new patch so far.  Keep up the great work.

Edit 2: I might be wrong about it being a hero of the day.  If it is not I am sorry, but I still believe that the risk vs reward is too small.  However, many people have brought up good points that these are like small balance changes to heroes in each game.  I think thats actually a really cool way of thinking about it and I think its useful to remember that when you discuss this change.~|suggest
The next Major should be played on Single Draft|self.DotA2|I heard all the pro players are practicing this mode every day. |suggest esports
Petition to get improved punishment system in Dota 2|self.DotA2|~Dear Valve,
I am a very big fan of your game, but it comes with a heavy toll on my spirit, welfare and mood. I simply cannot comprehend how so many people wish for the same thing and nothing is done to improve on it: **Improve your punishment system.**

These last 2 days alone I suffered 8 griefers in 12 games. Intentional feeding, selling items, ruining lanes all that kind of jazz, and I am 5.000 MMR. The fact that I feel these kids go unpunished is very harsh on my dream to improve. 

Even the pro players such as Puppey agree that intentionally feeding couriers, yourself etc. should be punished **WAY HARDER** than playing 5 more games in low prio. You simply need to **start dashing out some bans or minus mmr punishments**. People misbehave so much lately, and nobody cares if they get sent to low prio. 

I switched away from HoN because the community was so toxic. I can't believe I am about to give up on Dota because of the same issue. Please. Please. Do something about this.

Thank you. Much love.~|suggest
I made a quick mock-up of how a 5v5v5v5 Dota map could look (more info in comment).|i.imgur.com||suggest
Make this the new reddit header picture :( RIP source 1|imgur.com||suggest
Valve, please return "10/5 seconds remaining" voice notification to the drafting phase.|self.DotA2|Title. Have lost some gold because didn't realise it's time to pick already.|suggest
A UI mockup with some of the more common UI requests.|puu.sh||suggest
Valve, Want to literally get rid of 90% of boosters in one fell swoop? Do not allow Dota 2 to be shared on steam via "family sharing mode"|self.DotA2|~For those of you who do not know, giving your account away to an MMR booster is made safe and easy with "family sharing mode", a way of giving your account details over to someone else without them being able to do anything malicious, this is how people can comfortably share accounts and ruin games for everyone in the process. 

MMR boosting sites even proudly display this as the way they make sure you are safe to be boosted:

*"We are much more interested in keeping our customers happy and satisfied that can come back to us again or recommend our services to their friends. Moreover, stealing your account would be impossible if your account is secured by mobile authenticator or family mode. To make yourself feel comfortable by giving us detailed information of your account, we encourage you to use the full advantages of Valve's mobile authentication system or family sharing mode."* - taken from "BoostMMR.com"

taking away this safety net would make MMR boosters practically fall of the face of the earth as no one would feel comfortable enough to give their account details to some random person they don't know (as they rightly shouldn't) ~|suggest
If Valve makes $22M event just 1 day longer, we will not have best teams in the world playing 4 matches same time|self.DotA2|~Seriously, The International and Majors  biggest events in eSports history,  have best Dota teams playing 4 matches at the same time during Group Stage. Is it really so hard to make Group Stage a bit longer? Note that no need to rent venue for it.

Depends on format that Valve chose for The International and Majors, they will need to prolong Group Stage from 1 to 3 days to avoid 4 matches playing at the same time. ~|suggest esports
Petition to have Bulldog cast DAC tomorrow with Loda and EGM|self.DotA2|~Yesterday Loda made a tweet saying he was considering casting some of the DAC games. Bulldog is already doing it.

Please make it happen.~|suggest
Aghanim's Scepter: Riki|self.DotA2|~Riki Aghs upgrade: Riki's small stature makes him highly compact and flexible. Allows Riki to enter an allied players inventory, if there is space for the new item. Once in an ally's inventory, Riki functions as a normal item, with no control over his self.

If Riki is in an ally's inventory, the ally receives the current levels of invisibility and backstab, with backstab's agility multiplier transfering into a multiplier of the hero's main attribute.

Riki can be sold for his death value gold (amount of gold given to a single hero if they kill Riki. Riki can be consumed, transfering his total hit points and mana to the hero. Upon consumation or selling, Riki is killed. Upon respawn, Riki is fully controllable again, and all transfered passive buffs are returned to Riki. If the target hero dies while Riki is in their inventory, Riki is transferred to the closest flying animal courier. If no animal courier is available, Riki will lose an extra 120 gold and an animal courier will spawn at the base, with Riki in its inventory.

If the animal courier holds Riki in its inventory, it will gain Riki's passives, however will not gain an auto-attack.

The only way for Riki to emerge from item form is the death of the host hero, consumation or selling.~|suggest
I wanna see Purge do the weatherman segments in every Major.|self.DotA2|Valve please lend  your technology to the third party organizers. We really enjoyed Purge. |suggest esports
Instead of the Mango In-Game Advantage, Bonus Heroes Should Increase Chance Of Cosmetic Drop After Game|self.DotA2|~This is a fairer and better solution to promoting versatility in hero picks without having to compromise game quality.

Edit: thank you guys for your input, i realize that valve won't do this simply because it'll mean fewer hat profits but the point is that the reward for this action should stay outside the game, thanks! ~|suggest
This would be helpfull too|i.imgur.com||suggest
please add colours back to the TPs, who is teleporting in this picture?|i.redd.it||suggest
What if..|self.DotA2|~What if Valve will release winter battle pass + pudge arcana + 2 new heroes + event game THIS NIGHT?
~|suggest esports
Liquid.Matumbaman's suggestion for pre-game coin toss to be added to the pregame handshakes at offline tournaments.|twitter.com||suggest esports
Can XPM please be frozen after a hero reaches level 25?|self.DotA2|~There is no reason for this not to be the case. It would get rid of lots weird instances where a hero's XPM is much lower than their GPM in long games.

Really, it's not very important, but while Dota is being remade I don't see any harm in making XPM more meaningful to see who was getting more levels early on.

https://www.reddit.com/r/DotA2/comments/4aqfem/shouldnt_xpm_not_stop_counting_when_a_hero/

https://www.reddit.com/r/DotA2/comments/5emnqf/freeze_xpm_when_level_25_is_reached/~|suggest
Suggestion: An option to be notified when a friend finishes their match|i.redd.it||suggest
What if the stun indicator had a visualization of status resistance? [Shitty mockup]|i.redd.it||suggest
CONCEPT: An Aghs upgrade for IO, ILUSTRATED!!|i.imgur.com||suggest
Whoever behind the TI6 twitch streams, please edit the stream title to indicate which teams are playing|imgur.com||suggest
If I were to redesign the Source 2 client|imgur.com||suggest
Monkey King courier transform should transform to the current courier your team using not the basic donkey|self.DotA2|~to make him more broken xd and easier to fool enemy 

Edit: Mischief now copies the courier that your team has instead of the generic courier. We did it reddit

~|suggest
For the love of god give us back Recent Games view|self.DotA2|~My team mate randoms meepo, I can't see if he ever played it. 
I'm looking at recent major games to watch me some Sccc, I click his profile and go to look at recent games to maybe pick another out. DENIED by valve.   
Enemy has battlecup winners badge in loading screen, i wonder what he played. WONDER FOREVER.  
I get wrecked mid by a tinker player, if he's a dirty spammer maybe that takes some pain away? I bet this blyat picked Tinker for last 15 games. I try to check. Rage intensifies.  
Give me back my recent games Volvo for christ sake.
~|suggest
Suggestion: have Day[9] and Purge do the noob-friendly stream at TI|self.DotA2|~This would be a really good proposition for valve. Since day[9] is getting coached by purge already they have developed a dynamic perfect for teaching people how to play. Day9 can do pbp while asking questions to purge for further elaboration. Plus they've already shown that they provide entertaining content. It almost seems like a no-brainer.

EDIT: frontpage feelsgood. Ive seen a lot of good discussion for and against this suggestion SeemsGood. It seems the term 'noob friendly' was a tad overexaggerated, but a cast more like their coaching sessions would be the goal.~|suggest esports
can we have this instead of the stun bar?|i.redd.it||suggest
For the TIs, have an all caster/analyst match with pro players casting it!|self.DotA2|The title says it all.|suggest esports
Very simple stun indicator. Exactly where our eyes focus. Not distracting. What you think?|i.redd.it||suggest
Hero Progression Symbol Should Not Shift Chat.|i.imgur.com||suggest
Valve should introduce more ways to earn compendium points|self.DotA2|~At this moment we can't really earn new levels without buying additional points or 50 level compendium. Points drop rarely. So there are my suggestions:  
  
* **Aegis Offering/Recycle system** - TI4 recyling system should be added. This gave points every week for your unwanted items.  
* **Old achievements** - By this I mean 10 Hero challenge and daily hero challenge, reliable ways to earn additional points.  
* **Points Charm** - Many hates this idea, but that would be great if compendium owners will get these. 3 Correct Predictions - 50 points. 2 Incorrect Predictions - 2 charms fragments/100 coins.  
* **Player Cards** - I wonder if they actually introduce this. Last year we were collecting cards to get spectator gems and points for all cards. Volvo pls  
* **Points for collecting Immortals** - Ex. you get all non-rare items from first chest you get some points.   
* **Challenges for points** - Just like actual challenges, but grants you points instead.  
* **Points Betting/Predictions** - You pay points and choose which team you think will win. If you were right you get back points + additional points. However if you were wrong, then you lose all points you bet. More points you bet = More points you will get.  
  
That's all I came up with. Hope Valve will see it.  
  
**EDIT:** Frontpage, yay! Thank you guys.  
  
**EDIT2:** Wow, 1st on frontpage, thank guys for support! Volvo pls notice me~|suggest
Valve please make this notification happen.|i.imgur.com||suggest
Suggestions on how to make alt-clicking stuff more informative|imgur.com||suggest
How Invoker's orbs should really look with the new immortal|i.imgur.com||suggest
Valve can we have a mini AI tournament for TI6?|self.DotA2|~We can do something like this: http://sscaitournament.com/

Not only would this be entertaining but it'd give us [hopefully] better AI. The tournament winning AI doesn't necessarily have to be put into the game, if for example it simply isn't scripted well or properly. If anything the tournament could serve as an inauguration of sorts, the beginning of community collaboration on the AI. I feel like Dota has come so far yet our bots remain absolutely atrocious. All it would take on Valve's part would be to make the current bot AI open source and to put like.. 1000$ (pocket change for GabeN) on the line for the winner. Like I said, if for some reason Valve deems the winning AI subpar then worst case scenario we had a super refreshing and entertaining mini tournament, and a better starting point for further AI work.
What do we think?


EDIT:    ..  but perhaps certain rules could be stipulated to prevent this, that is, for example, the winner is not simply the bot that wins that games, but rather behaves the most like a human!~|suggest
How about featuring the most liked game of yesterday on the main screen?|self.DotA2|i was thinking that we have a great spectate system available, many people are watching the highest ranked pub games and giving them likes/dislikes but after the game's over, they mean nothing. Instead, we can vote for the best game of the day and valve can feature that match on the main screen so people can download the replay and have the chance to watch a great match they may have missed yesterday. anyway i tought that'd be cool.|suggest
When IceFrog retires I hope he writes a book.|self.DotA2|~Like the title of each chapter would be a Patch #

and the chapter would be an autobiography of his work/life during that time. 

~|suggest
Petition for EE "Gebak gebak gebak" voice line added to customised chat wheel|self.DotA2|This would be awesome !|suggest
Come on Valve. How hard is it to implement a HUD like this? Credit to kradnozd|i.redd.it||suggest
Re: Blink Penalty|self.DotA2|~(Yes a million threads complaining about this have been made before, but hear me out).

If the blink mechanic is to stay (which looks likely), what could  make it vastly easier to learn is to provide some sort of visual/auditory feedback. This way you would know when you have blinked over the max range or when you have succeeded in clicking between 960-1200 units.

&nbsp;

For example;

* If you blink 960 units or less (which would include clicking over 1200 and being punished) the game plays the standard blink sound and animation.
* If you blink over 960 units the game plays a slightly modified blink sound to indicate you have made a good blink.

I believe this would make the mechanic far more accessible to those attempting to learn it as it provides positive feedback after every blink, forcing the player to eventually learn the range subconsciously.

&nbsp;

Edit: Well, I hope Valve saw this now it's going to get buried beneath th... my download just finished bye.~|suggest
Mr Valve, Please add a talent for Winter Wyvern where you can cast "Splinter Blast" on an ally.|self.DotA2|~Imagine how awesome is that, ES rolls in following Splinter Blast, nuke down a whole enemy team (maybe).
~|suggest
Give new players FREE 1-month DotaPlus assistant.|self.DotA2|~This will allow them to learn the game better with DotaPlus assistant suggestions, give them understanding of items and heroes and make them want to buy DotaPlus for more of that.

For everyone in comments circlejerking about smurfs and boosters : I do not suggest giving all benebits of DotaPlus, but assistant part, which i very clearly stated in the header.~|suggest
Players should receive a notification when they get commended|self.DotA2|~Seriously, no one can even tell they got a commend unless the person tells them in the game that they're going to commend you, unless you actually keep track of the number of each specific type of commend you have.
I know that commends don't really give you any type of bonus to your account, but it IS really nice to know someone appreciated your in-game performance enough to give you a commend.
And if this is actually added, it should also give the person's name who commended you.

edit: wow I really did not expect this to get that many upvotes.~|suggest
Icegaben pls bring the shopkeeper's game back so we can learn the item changes faster|self.DotA2|~I mean it is the moment when we really need it.
Sorry for bad englando~|suggest
Petition to have 2GD host TI7|self.DotA2|With all those petitions why not try that one!|suggest esports
Bloodseeker Rupture buff idea.|self.DotA2|how about making it like mana leak? so the target get stunned for a moment when their hp get depleted|suggest
