Petition to permanently ban anyone who posts '100% winrate in 2018' after their first match of 2018|self.DotA2|Pack it in, we've all had a bit of fun|suggest
Make the sell option require 2 factor authentication|i.redd.it||suggest
[Suggestion] Let us see our team mates heroes behinds ours in the pick screen.|i.imgur.com||suggest
So I did some HUD tweaks|i.redd.it||suggest
Some QoL and Visuals-related suggestions (2)|imgur.com||suggest
Some QoL and Visuals-related suggestions (1)|imgur.com||suggest
Disable reporting during the game|self.DotA2|~In light of new changes to reporting system, I suggest another change: Disable the report option on the scoreboard while match is going on. If someone still wants you to report after the game ends, he has the ability to do so.  People get often reported when they make a mistake during the game or make someone rage accidentally . Personally I have to admit I report people sometimes who trigger me whom I wouldnt report at the end of the game

Do you think this change would improve the reporting system?


Edit: damn i went to sleep with this thread having 6 upvotes now it has 3700.

>Well Played!

Edit2: [WE DID IT REDDIT](https://www.reddit.com/r/DotA2/comments/5bq68y/dota_2_update_main_client_november_7_2016/)~|suggest
[Suggestion] Recipes showing the item they are for|i.imgur.com||suggest
Dota is a Game with more than 10,000,000 Players worldwide, can it please finally get a fixed Staff to ensure all it's Features are getting maintained?|self.DotA2|~It feels like most features of this game are broken and have been abandoned. Tutorials, Bots, Custom Games, Effigies, Gems, Weather, Loading Screens are useless and hell, there are even Team Pennants from fu**ing TI2 that were never updated and the reason for all of this is Valves Firm Policy that allows everyone to change the projects they are working on whenever they want. Basically, if the Developers that worked on the Custom Game Editor want to work on something else inside the company, they are free to do so and it will never get updated again unless someone else does the work.

~|suggest
Why is "Scan" still called "Scan" and looks like something out of Call of Duty? We should have something more LORE FRIENDLY|self.DotA2|~Yes, scan actually does "scan" an area, but i dont get how it fits into the universe. Its a legit radar icon and makes pinging noises, like there is a UAV flying overhead and if I get 10 kills i should be able to call in a AC130

I would suggest we call it something like "eyes of the ancient" and have the icon be an observer ward like eye. When activated instead of a radar animation it could be a outline of a eye frantically looking in every direction, but if sees something it turns red and the eye opens wide, alert. https://imgur.com/a/1Q1Vv

Lore wise it would make sense too, as if to suggest that the ancient itself is mustering power to look at a specific place on the map to aid it's brainwashed heroes in their battle, but much like re-spawns it takes time for the ancient to recharge its power.

Thanks for read~|suggest
Give us the ability to alt-clicking Shrines to call allies for group heals.|self.DotA2|~Spreading the love will be easier.

*Edit* We did it Reddit! :P Ours is the power. Ours is the glory. They are listening to us. We are in good hands :) <3~|suggest
  _  GIFF ROSHAN SANTA HAT   _ |self.DotA2|~  FROSTIVUS IS UPON US  

 BUT I INSIST WE DELAY 

  _   [UNTIL WE GET A SANTA HAT](https://i.redd.it/5c39fod8973y.jpg)   _  

  TO MAKE ROSHAN'S HOLIDAY  ~|suggest
My proposed Dota 2 All Pick UI redesign|imgur.com||suggest
Valve, it's time for some much needed features and community reform.|self.DotA2|~I've never been good at introductions but I think it's time we see some real changes to help Dota grow. Valve has shown that it wants to start promoting the game and adding features to help attract and hook new players which is really great, but what really prompted me to make this thread is the sudden increase in the number of threads regarding toxicity in games and the community in general. Dota's player base has also been quite stagnant for years now and the top reasons new players quit, is due to experiencing smurfing and toxicity in games, this is further worsened by a insufficient tutorial which doesn't provide the necessary tools for newbs to succeed.  This thread is solely to address issues within the community that I and many others have experienced. Here are my ideas to help remedy this and make Dota a more pleasant experience in all of this. Please note that these changes do not aim to remove in game systems, but are additions or expansions to existing ones. (The exception to this is in regards to the arcade)

#REWARD GOOD BEHAVIOUR
The first step is promote good behaviour and reward players for being friendly and teaching to others. It's been proven that positive reinforcement can do wonders and can really improve a person's attitude and performance, so if there were a system implemented that allowed players to be rewarded for being good people, this would greatly improve the overall atmosphere in game. First off, **commending needs to be encouraged more often**, it's not uncommon that we simply forget to commend someone with found enjoyable or friendly in a match, but we almost never forget to report a annoying or unpleasant player.. A good method is to have a screen at the end of a match, that's dedicated to commending which would be seen before the regular score screen. For rewards, they can range from** actual rewards** such as a chest, an exclusive item, special terrain skin or a set, which the chance of receiving would justify for many players the extra effort it can be to be more forgiving and understanding. The next method and what I believe to be the most important/effective is to give players that have been exceedingly good something to show off. Why? Because **Dota player's love to brag** and what better way to promote good behaviour than to grant a temporary badge of honour to make it real clear, who's **better than the rest of us**.

#MORE REASONS TO PLAY
Dota is a incredibly stressful and emotion game to play, but have you ever wondered why? It's because **winning is everything**. Everything about Dota creates the expectation that you should be trying to win every game that you play, so much so that even in the games that you have no control over, **you feel like a loser** and it's because you have failed every win condition in or outside the game. What I'd propose is a way to soften the blow of losing and to add more ways to "win" at Dota. Loot creates, set collecting, in game currency, farming commends, quests, achievements are all common themes in other multiplayer games and can create a much more casual experience for those who aren't interested in tri-harding, spamming ranked and gaining MMR. Make it so, even if you lose, you still gain something, acknowledge the fact that **Dota is an incredibly emotional game** and do something about it. Now for the big one and this will lead into my next idea, add more ways to "win". **Tournaments, In-House leagues, guilds, clans and the arcade**. Having more player goals to work towards is real important to decreasing stress and frustration after a loss because it gives other reasons and goals to work toward which aren't completely defeated when losing a match.

#REDUCE ANONYMITY, INCREASE COMMUNITY AND BELONGING
The current Dota promotes to much individualism, solo queue being the only MMR that matters and there being almost no way to interact with your fellow players, creates even more anonymity compared to a standard internet community and is further promoted by the ability to change your name any time and to anything. By giving people a concrete community to belong to, you can reduce the amount players act as if nothing matters, by allowing them to develop their own reputations and friends amongst community groups. My suggestion to implement guilds, clans and groups, but before I go into this topic, I'd also like to explain why guilds and clans failed in Source 1 and it's because there was no reason to create one, there was no way to interact directly with clan/guild mates and there was nothing to give clan/guild members a sense of belonging. Here's how to make it work in various stages:

* First idea is to give **tournament organisers and broadcast studios the ability to create tournament pages and groups**, so that people can subscribe them, promoting this and implementing into the client is very important. This allows the tournament organiser/studio to **notify their members** on steam, on your phone, on your twitch, when a match they are hosting has started, allows members to chat with each other, before, during and after a game. Also this give tournaments and studios a means to directly communicate with their audiences. **Allow these groups to moderate themselves**, this is very important because Valve I know how you hate interacting with the community.

* Secondly, give **Teams the ability to create their own** pages and groups, for the same reasons. Allow them to promote themselves, do giveaways, notify their fans of upcoming games and host a place of discussion before, during and after a game. Give an option to merge chat channels, so that tournament organisers, studios and teams and interact together. 

* Next is to allow users to form their own groups. This will be mainly for people who have a big following to have their own dota following, people such as AdmiralBulldog, Purge, Day[9], GrandGrant, BurNing, Dendi a place for their fan base to talk with each other and be notified when they're streaming, playing, if they've join a new team, uploaded a new video. Also allow them to moderate themselves.

* **In-house Leagues** come now, allow every group to host their own In-house League, many of you have seen how **successful FPL** was/is and I'm sure the top players enjoyed it immensely. Anonymity is both the greatest strength and weakness of the internet, it not only allow you to escape, but also allows people to incredibly toxic to others because they have their true identities hidden. This solves 2 problems, playing with randoms you don't know and have no connection with and top level players being queued for unreasonable amounts of time. I suggest groups that host in-house games have rules that their users either have to use their pro names or not be able to change their name after joining or even have it shown in brackets next their current name.

* Teams/Squads and **Regular Tournaments with no pay wall**. This is for players that want to play the more competitive side of dota, have the ability to create teams that are not qualified to enter minors or majors, but can enter weekly tournaments for small prizes or just tournament wins and profile borders/stats. This **separate to Battle Cup**, where it's seasonal, requires a ticket and also provides better rewards. Have groups also be able to host their own tournaments, either in themselves or against other groups, this is to spark community interaction and rivalry amongst bigger groups. **Teams should have results, prizes and ranks tied to the team** to discourage players from endless creating useless teams.

* Last suggestion is for **Arcade/Community Workshop groups.** Groups that are dedicated to a arcade game or a workshop developer, give these guys a way of building their own followings, like they did in Warcraft 3. Have groups especially for workshop development and tutorials. This will also require a rework of the current arcade, it's a disaster, you can't even play as a party without each individual person finding the game and downloading it, like at least give each player in the party a prompt to download it.

To reiterate the important points allow users the ability to **create groups inside the Dota client**, so that they they can **receive notifications** about matches, streams new videos etc. Allow for the **creation and hosting of in house leagues** inside the client so that players can play games with a group of people they are more familiar with. **Host Regular tournaments** to provide for players looking for a more competitive experience. Allow these **communities to customise and moderate themselves**, set their own rules and requirements for joining, private of public. This will not only decrease the workload on your end Valve, but allow these groups to be more personal and niche. **Promote and support these features to come, community and a sense of belonging are what keeps players here even if the game doesn't.** 

#THE ARCADE
This could be Dota's strongest feature, very few games have good mod support and Valve you may just find your next winner from this. Starcraft and Warcraft were all wildly successful thanks to their great mod support, and 3 of your most popular games were previously mods, I think it's time to pay some respect to this portion of Dota 2. From the player perspective the arcade and custom game section has always been a part of the game to unwind and find something new, to relieve some of the tension from regular Dota, even Starcraft 2's arcade which was considered a disaster is still a popular place players go to for some time to kill. The arcade unlimited potential and can also be used to help new players to Dota, user submitted tutorials or using custom maps as a means to get used to basic mechanics and controls. The biggest problems of the arcade right now are that: 

* **It doesn't work** The lobby doesn't allow you to kick players that are afk, select colour, position, race, role, you can't play a new game as a party without having each party member finding the game and individually downloading it and every game bar the top 10 - 20 are dead. In Warcraft 3, there was no list of popular games, there was only open lobby and the list of games was only sorted by genre and came from sites like epicwar and hiveworkshop (which also had most popular, but was defaulted as what's new).

* **It's hidden**, currently the arcade is hidden away behind a tab. A unsorted list of open lobbies (for your region/ping) should just appear on the front page as a panel and if you wish to browse or host your own game you can go to the arcade tab. In my opinion, the list should only include minimal information such as thumbnail, game name, game type and host name, but do not include number of players to allow lobbies to fill up more evenly and naturally. This is to promote and keep the idea of the arcade in everyone's mind and make it feel like the arcade is as important as the main game.

* **Provided resources for developers** I just feel as if the number of doodads, props and tile sets Valve provides to workshop artists is very little and makes making games much to timely. In Warcraft 3, many of the best games and classics used the default models and tile sets provided by the game itself and it was only after many years that games with many custom models and tile sets appeared, but only after there were a huge variety of games to play, many of which were modified melee maps. Edit: This may be of an issue of the editor being too difficult to use rather than a lack of provided materials. In which case an easier more user friendly should be developed, similar to the wc3 editor.

* **Unit Control** Valve just copy like Starcraft or Warcraft for this part, the current HUD and Unit control systems just don't allow for good unit control, meaning games which only allow you to use one character are the only things worth even considering.

* **The arcade should be part of the tutorial**. Using custom maps to allow players get used to different game play mechanics, such as cast times, turn rates, fog of war. Adding challenge and verse modes for each of the scenarios would be such a fun way to learn Dota. Most importantly, these mini games should point to the arcade as a means to find alternative versions or other fun mini games.

#PROS HAVE TO BE MADE ACCOUNTABLE
**Pros represent the game and the community**, so anything they do that promotes shitty and toxic behaviour has to be punishable. I'm **NOT** talking about the occasional and rare instances of toxicity caused by shitty moods or accidents, but rather **extreme and regular instances** of flaming, abandoning, intentional feeding, doxxing, stream sniping, raiding is **NOT OK**. The outside world is peering into your home, at least pretend to have it be clean and inviting. Note: When talking about pros, I'm talking streamers, tournament attendees, Youtubers, studios, casters, anyone and everyone who has a larger than normal public image. 

Edit: This was not my strongest point, you guys have made it quite clear. I'm not asking pro's to become community role models, but I do still believe that Valve should at least be a little more strict toward these individuals. This is probably most popular topic of discussion as it's the only one that people have actually replied for both sides, rather than disliking it for the sake of it.

#A WALL FOR SMURFS
The current barrier for entry is incredibly low, which is seemingly great for new players, but is ruined due to rampant smurfing. It's important to decide **which features of Dota, new players can make use of**. New players should be at least required to play multiple ~~~~bot~~~~ co-op vs ai games **on and against** a **limited hero pool** before versing **players of their level**, told about hotkeys and basics of RTS, such as multiple unit control. **Having all the heroes at your disposal is great for experienced player but is useless to new players** which should only be playing 1 or 2 heroes at the most, whilst they get a grasp of the game. A lesson from League of legends, which I know mentioning is taboo, but they have a much less rampant smurfing at the really low level because there is such a large wall between starting from scratch and having all the features unlocked, that most experienced players would rather pay for level 30 accounts instead of levelling a new ones from scratch. I don't have any concrete suggestions for this part, but I highly recommend baring the most prominent but most useless features of Dota 2 for new accounts to reduce smurfing.

> To clarify, the main idea is to identify the main aspects of dota which are considered core. Identify which of these are unimportant to players that are just starting or learning the game. And introducing these concepts slow enough that it becomes unappealing for experienced players to want to make an account and playing through this process which would otherwise go unnoticed by a truly new player. League does this by slowly unlocking summoner spells, giving talent points and unlocking runes over 30 levels which is like 100+ games. This process is considered progression by newer players and isn't annoying. Experienced players however, would rather not go through this process because it takes ages and isn't worth being able to Smurf. Although it doesn't remove everyone, it reduces the number of Smurfs enough that it isn't really noticed by new players and the majority of Smurfs lie at level 30 from bought accounts or play which is way beyond what a brand new player would encounter. Note how it doesn't remove Smurf from the game, just reduces the chance of a new player encountering one, which is the point.

#FOR THE NEXT GENERATION
This game lives off its player base, this game lives and dies with the players. I suggest creating a coaching program for new players, this program would **involve a experienced player with a good behaviour record to volunteer** and coach a new player 1 on 1 for their first 5 - 10 games. This is to help new players get a grasp on the game from someone who is experienced, yet also promotes positive attitude and condemns poor behaviour and sportsmanship. These **volunteers will of course be rewarded** for their time and if the player they **coached sticks around** for say 50 games. Rewards can be similar or even more exclusive than good behaviour rewards stated above and of course a nice badge for some bragging rights. Adding mini games and challenge scenarios for core mechanics may also be strong method of introducing Dota to players which are interested but feel they aren't ready for a real match. Valve has shown it isn't above using user submitted content as main selling points in games and using arcade features to expand the tutorial and join the arcade and Dota communities together is a win-win scenario.

#TO THE COMMUNITY
This is still up to you guys, you can really make this place much better and more welcoming. I know there a many of you that that have been around for ages and love this game. So keep do your part in condemning toxicity, but more importantly promote the creation art work and community interaction, good play, commend and add nice and kind people (a friend request goes a long way and is worth even more than a commend) and remember this a game, just try have fun.

#TO VALVE
You've recreated my favourite game of all time and have continued to support it and although I haven't agreed with every approach you took and I've wizened up to your increasing greed over the years, I'm still eternally thankful. You know full well, how important it is to grow the player base of a free game, just think of the millions you can make with the millions of new players that join. I just hope you make the right decisions whatever they may be and bring Dota and it's community to new heights.

Edit 1: Added clarification to The Wall for Smurfs Sections.

Edit 2: The majority of you guys agree that Pro's should not be made role models and should act and punished as if they are normal players.

Edit 3: Thanks for my first gold and reddit silver /s

Edit 4: I've read essentially every reply so far, but i gots to sleep. Remember --> **community** <-- use it solve our problems.

Edit 5: In the wall for Smurfs section, I do mean coop vs ai matches, not bot matches. A few of you are quite opposed to limiting the hero pool for new players, although my actual suggestions for this part aren't weren't meant to be concrete, I still think it would do less harm then good, but the main way of teaching newbs is through coaching and enhanced tutorial.~|suggest
In This Episode Of Literally Unplayable|i.redd.it||suggest
Since loading screens are now no more, can we use them for something like this?|imgur.com||suggest
Since valve is making changes in visual effects, these suggetions are GODLIKE!|self.DotA2|~I didn't create these suggestions but I saw then reposted 2 days ago and the post didn't get too much notice, so let's try again and make this reach valve!!!! Because these suggestions are amazing! I would dare say it was originally create by [*cuivron.imgur*](http://imgur.com/user/cuivron/submitted) or [*u/cuivron*](https://www.reddit.com/user/cuivron), since the *imgur* post was made by him.


Here are the suggestions:


[**PART 1**](http://imgur.com/a/5P0AC)

[**PART 2**](http://imgur.com/a/4fWn3)

PS: If valve is trying to make the game more friendly to new players, these suggestions should be made NOW! Really, they're all **awesome**. My favorite one is the [windrunner's missed shackleshot](http://i.imgur.com/8jRnwj7.mp4). What are yours?


***EDIT:***
WOAH! First reddit first page! Thanks guys, that was the point of making this post! Well played! Hope these changes reach valve and they use some of it

***EDIT2:***
Hey, should we spam this at anywhere official? I think we should!!! I emailed valve with these suggestions, if you guys have anyother official gateway, post it here or just send them these amazing suggestions made by [**cuivron**](http://imgur.com/user/cuivron/submitted), they're all freaking awesome!

***EDIT3:***
Well, since it's kind of a repost, but a good repost, let's give proper credit! I just found **cuivron** original post, here it is: [*all hail cuivron!!!*](https://www.reddit.com/r/DotA2/comments/4sdu4s/some_qol_and_visualsrelated_suggestions_1/) ~|suggest
UI is getting better and better, but we still miss these things.|self.DotA2|~* "Learn ability" hotkey option, I don't know why you would remove options we had for so long, when it's just a hotkey. (Alot of people are writing that you can ctrl-hotkey to level up. I know this but I hate to use the ctrl button, Ctrl-Q for example feels so awkward)
 
* Learn talent hotkey. One hotkey to bring up the talent tree, and then 2 more hotkeys, one for left talent skill and one for the right.

* (New suggestion from comments about how you could skill talents) rather said if it worked like the chat wheel and the screen was split down the middle and you hover left or right could be good

* Bring hp/mana bars above the skills, placing them at the very bottom of the screen is really annoying.

* Last hits, KDA to be shown at all times. I promise you, Dota 2 viewer count on twitch will decrease if this is not fixed. The players stream. It's really boring to watch a stream if you can't see their score, last hits etc. 

* Give a better XP bar, not one who is in a circle, also would be good to show the numbers without pressing alt.

* Option to turn of the new sound when something happens in the game, kills towers etc.

* Move the gold to be closer to the center of the screen, you can add the quickbuy things to the very bottom and put gold + courier usage above it. Let the gold be to the left, and courier to the right (now gold is to the right)

* Add hotkey to "take backpack items", just like we have for "take stash items"

* Buff/debuff icons.
